{
  "contract_version": "1.0",
  "course_title": "数据库原理与应用",
  "practice_title": "实践：从订单 ER 关系到客户级聚合查询",
  "audience": "高职软件技术专业学生，已学习关系模型、基本 SELECT 和常见数据库工具",
  "duration_minutes": 90,
  "course_context": {
    "course_name": "数据库原理与应用",
    "audience": "高职软件技术专业学生，已学习关系模型、基本 SELECT 和常见数据库工具",
    "language": "SQL",
    "tools": [
      "MySQL Workbench",
      "draw.io"
    ],
    "platform": "Windows 实训室",
    "software": "MySQL 8.0 / MySQL Workbench",
    "database_dialect": "MySQL",
    "other_constraints": [
      "实践查询按 MySQL 8.0 语法验证",
      "先分段运行再核对结果粒度"
    ]
  },
  "source_courseware": {
    "mode": "courseware",
    "contract_version": "1.0",
    "chapter_title": "订单 ER 模型、连接与聚合查询",
    "taught_slide_ids": [
      "db-01",
      "db-02",
      "db-03"
    ]
  },
  "knowledge_links": [
    {
      "id": "db-entity",
      "title": "业务事实到实体",
      "summary": "从业务句子识别可独立描述的实体，并区分实体、属性和一次事件。",
      "source_slide_ids": [
        "db-01"
      ],
      "student_can_do": "能为客户、订单等概念选择合适的实体边界。"
    },
    {
      "id": "db-cardinality",
      "title": "实体关系与基数",
      "summary": "用业务数量约束表达一对多、必选/可选关系，并把规则落到 ER 图。",
      "source_slide_ids": [
        "db-01"
      ],
      "student_can_do": "能从场景句推导关系方向和基数。"
    },
    {
      "id": "db-key-join",
      "title": "主键、外键与 JOIN 路径",
      "summary": "连接条件应沿主键—外键关系书写，避免把无关字段拼在一起。",
      "source_slide_ids": [
        "db-02"
      ],
      "student_can_do": "能从 ER 关系走出正确 JOIN 条件。"
    },
    {
      "id": "db-result-grain",
      "title": "结果粒度与筛选位置",
      "summary": "先说清一行代表什么，再决定 WHERE 条件和日期范围如何限制结果。",
      "source_slide_ids": [
        "db-03"
      ],
      "student_can_do": "能判断查询结果是一客户一行还是一订单一行。"
    },
    {
      "id": "db-aggregate",
      "title": "聚合、分组与业务回答",
      "summary": "COUNT、GROUP BY 和排序要共同服务“有已完成订单的客户及订单数”这一业务问题。",
      "source_slide_ids": [
        "db-03"
      ],
      "student_can_do": "能把业务问题翻译成可核对的聚合查询。"
    },
    {
      "id": "db-tool-verify",
      "title": "Workbench 分段运行与结果核对",
      "summary": "先运行连接路径和筛选片段，再检查完整查询的列、行数和排序。",
      "source_slide_ids": [
        "db-02",
        "db-03"
      ],
      "student_can_do": "能用 MySQL Workbench 分段定位查询错误。"
    }
  ],
  "tasks": [
    {
      "id": "db-map-core",
      "level": "core",
      "title": "从业务句提取 Customer 与 Order",
      "knowledge_link_ids": [
        "db-entity",
        "db-cardinality"
      ],
      "source_slide_ids": [
        "db-01"
      ],
      "modality": "modeling",
      "overview": "把“客户下过订单”拆成实体、属性和关系，先在 ER starter 中核对一对多语义。",
      "scaffold": "draw.io 文件已给出 Customer、Order、主外键字段和示例关系；学生只补待核对槽，不从空白建模。",
      "steps": [
        {
          "title": "圈实体",
          "instruction": "在业务句中圈出可独立描述的客户和订单。",
          "check": "实体名称与字段层次分开。"
        },
        {
          "title": "看关系",
          "instruction": "用‘一个客户可以有多个订单’复述基数。",
          "check": "能说出两端数量。"
        },
        {
          "title": "核 starter",
          "instruction": "打开 orders-er.drawio，检查主键、外键和关系线。",
          "check": "文件可继续编辑。"
        }
      ],
      "acceptance": [
        "Customer/Order 边界正确。",
        "一对多关系能用业务句解释。",
        "PK/FK 位置不混淆。"
      ],
      "help_refs": [
        "db-entity",
        "db-er-tool"
      ],
      "estimated_minutes": 10,
      "starter_asset_ids": [
        "db-orders-er"
      ]
    },
    {
      "id": "db-key-core",
      "level": "core",
      "title": "沿主键—外键走出 JOIN 路径",
      "knowledge_link_ids": [
        "db-key-join"
      ],
      "source_slide_ids": [
        "db-02"
      ],
      "modality": "sql-reasoning",
      "overview": "从 ER 关系推导 Customer JOIN Order 的条件，不凭字段名称相似度猜连接。",
      "scaffold": "互动中心先给出关系图和字段卡；学生把连接条件写成一行并核对两端字段。",
      "steps": [
        {
          "title": "找主键",
          "instruction": "在关系图中标出 Customer.customer_id。",
          "check": "主键唯一标识客户。"
        },
        {
          "title": "找外键",
          "instruction": "标出 Order.customer_id 并说明它指向哪里。",
          "check": "外键指向 Customer 主键。"
        },
        {
          "title": "写条件",
          "instruction": "写出 JOIN 的 ON 条件并用一个样例行解释。",
          "check": "两端 customer_id 对齐。"
        }
      ],
      "acceptance": [
        "JOIN 条件沿 PK/FK。",
        "没有把 order_id 与 customer_id 拼接。"
      ],
      "help_refs": [
        "db-join",
        "db-er-tool"
      ],
      "estimated_minutes": 12
    },
    {
      "id": "db-grain-core",
      "level": "core",
      "title": "先说清一行代表什么",
      "knowledge_link_ids": [
        "db-result-grain"
      ],
      "source_slide_ids": [
        "db-03"
      ],
      "modality": "analysis",
      "overview": "在写聚合前决定结果粒度：本题一行代表一位有已完成订单的客户，而不是一笔订单。",
      "scaffold": "任务给出订单明细和客户汇总两个结果表，学生只需标注粒度并指出重复来源。",
      "steps": [
        {
          "title": "看原始行",
          "instruction": "观察同一客户出现多笔订单时的明细行。",
          "check": "能指出一客户多行。"
        },
        {
          "title": "定结果",
          "instruction": "把目标结果改写成“一客户一行”。",
          "check": "业务问题和结果粒度一致。"
        },
        {
          "title": "放筛选",
          "instruction": "说明状态与日期条件先限制订单，再进入分组。",
          "check": "筛选不会误读客户粒度。"
        }
      ],
      "acceptance": [
        "明确一行=有已完成订单的客户。",
        "能解释为什么需要 GROUP BY。"
      ],
      "help_refs": [
        "db-grain",
        "db-results"
      ],
      "estimated_minutes": 10
    },
    {
      "id": "db-sql-core",
      "level": "core",
      "title": "补全月份完成订单聚合查询",
      "knowledge_link_ids": [
        "db-key-join",
        "db-result-grain",
        "db-aggregate"
      ],
      "source_slide_ids": [
        "db-02",
        "db-03"
      ],
      "modality": "sql",
      "overview": "在 MySQL 8.0 查询框架中修正 4 个真实关键空位，得到 2025-02 月有已完成订单的客户及其订单数。",
      "scaffold": "starter 已给出 SELECT、JOIN、WHERE、GROUP BY 和 ORDER BY 外壳；TODO 对应计数对象、状态和月份半开区间。",
      "steps": [
        {
          "title": "读问题",
          "instruction": "把业务问题拆成对象、状态、月份、粒度和排序。",
          "check": "五项均有对应 SQL 位置。"
        },
        {
          "title": "补关键空位",
          "instruction": "修改 COUNT、status 和月份上下界四处实际位置。",
          "check": "不删掉 JOIN/GROUP BY 外壳。"
        },
        {
          "title": "分段运行",
          "instruction": "先运行 JOIN 与 WHERE 片段，再运行完整聚合查询。",
          "check": "分段结果能解释完整结果。"
        },
        {
          "title": "核结果",
          "instruction": "检查列名、每客户一行和 completed_orders 降序。",
          "check": "结果粒度正确。"
        }
      ],
      "acceptance": [
        "4 个真实 SQL 编辑点已修改。",
        "无 `= NULL`，状态为 completed。",
        "按客户分组且月份为半开区间。"
      ],
      "help_refs": [
        "db-grain",
        "db-sql",
        "db-workbench"
      ],
      "estimated_minutes": 18,
      "starter_asset_ids": [
        "db-orders-sql"
      ],
      "todo_count": 4
    },
    {
      "id": "db-diagnose-core",
      "level": "core",
      "title": "SQL Debug：定位结果行数不对",
      "knowledge_link_ids": [
        "db-result-grain",
        "db-aggregate"
      ],
      "source_slide_ids": [
        "db-03"
      ],
      "modality": "sql-debug",
      "overview": "通过诊断区区分连接条件错误、筛选口径错误、分组粒度错误和计数对象错误。",
      "scaffold": "给出四种可观察症状和对应查询片段；学生先猜原因，再用结果粒度验证。",
      "steps": [
        {
          "title": "看症状",
          "instruction": "完成 SQL 诊断选择，不先改整条语句。",
          "check": "每个症状对应一个可能原因。"
        },
        {
          "title": "查粒度",
          "instruction": "比较明细行和分组结果的行数。",
          "check": "能说明重复或遗漏来源。"
        },
        {
          "title": "定修复",
          "instruction": "选一处最小修复并复述预期结果变化。",
          "check": "修复不破坏已正确的关系。"
        }
      ],
      "acceptance": [
        "能区分 JOIN 错和 GROUP BY 错。",
        "能用一行代表什么解释结果。"
      ],
      "help_refs": [
        "db-debug",
        "db-results"
      ],
      "estimated_minutes": 12
    },
    {
      "id": "db-workbench-optional",
      "level": "optional",
      "title": "用 Workbench 分段核对查询",
      "knowledge_link_ids": [
        "db-tool-verify",
        "db-result-grain"
      ],
      "source_slide_ids": [
        "db-02",
        "db-03"
      ],
      "modality": "tooling",
      "overview": "在 MySQL Workbench 中按连接、筛选、聚合三段运行并核对列、行数和排序。",
      "scaffold": "提供三段可复制的查询片段和检查表；学生不需要搭建数据库项目，只需使用已有样例表。",
      "steps": [
        {
          "title": "跑连接",
          "instruction": "先只 SELECT 客户名和订单号，观察一客户多行。",
          "check": "能说出明细粒度。"
        },
        {
          "title": "跑筛选",
          "instruction": "加入 completed 和月份条件，核对订单集合。",
          "check": "筛选口径与问题一致。"
        },
        {
          "title": "跑聚合",
          "instruction": "加 COUNT/GROUP BY/ORDER BY，核对一客户一行。",
          "check": "最终粒度成立。"
        }
      ],
      "acceptance": [
        "三段结果都能解释。",
        "能指出哪一步改变了粒度。"
      ],
      "help_refs": [
        "db-workbench",
        "db-results"
      ],
      "estimated_minutes": 10
    },
    {
      "id": "db-constraint-optional",
      "level": "optional",
      "title": "复核 ER 约束与查询假设",
      "knowledge_link_ids": [
        "db-key-join",
        "db-tool-verify"
      ],
      "source_slide_ids": [
        "db-02",
        "db-03"
      ],
      "modality": "modeling-tool",
      "overview": "检查 ER 图中的主外键和状态字段是否支持查询假设，指出一个如果约束缺失会出现的风险。",
      "scaffold": "使用已有 ER starter 和 SQL 查询；学生只需在复核卡中标记关系/字段风险。",
      "steps": [
        {
          "title": "逐字段核对",
          "instruction": "核对 customer_id、order_id、status、order_date 的角色。",
          "check": "字段角色和查询位置一致。"
        },
        {
          "title": "看风险",
          "instruction": "指出外键缺失或状态值不统一会造成的结果问题。",
          "check": "风险能对应一条查询。"
        },
        {
          "title": "回模型",
          "instruction": "在 draw.io note 中补一句约束说明。",
          "check": "模型和查询语义相互支持。"
        }
      ],
      "acceptance": [
        "至少指出一个真实约束风险。",
        "能说明风险影响连接或筛选。"
      ],
      "help_refs": [
        "db-er-tool",
        "db-debug"
      ],
      "estimated_minutes": 8,
      "starter_asset_ids": [
        "db-orders-er"
      ]
    },
    {
      "id": "db-challenge",
      "level": "challenge",
      "title": "迁移：设计一个不改变粒度的业务问题",
      "knowledge_link_ids": [
        "db-entity",
        "db-cardinality",